{
  "requestDate": "2017-07-29T22:25:37Z",
  "requesterId": "21932a85-bd00-446b-9565-46e0c1a5490b",
  "instanceId": "195efae1-588f-47bd-a181-13a2eb437701",
  "requestLevel": "Item",
  "requestExpirationDate": "2017-07-25T22:25:37Z",
  "pickupServicePointId": "8359f2bc-b83e-48e1-8a5b-ca1a74e840de"
}
